{
  "$schema": "https://json-schema.org/draft/2020-12/schema",
  "$id": "https://schemas.commandlayer.org/schemas/v1.0.0/trust/authorize/authorize.request.schema.json",
  "title": "CLAS Trust Authorize Request",
  "description": "A request to authorize a principal to perform an action on a resource.",
  "type": "object",
  "additionalProperties": false,
  "required": [
    "version",
    "family",
    "verb",
    "principal",
    "action",
    "resource"
  ],
  "properties": {
    "version": {
      "const": "1.0.0"
    },
    "family": {
      "const": "trust"
    },
    "verb": {
      "const": "authorize"
    },
    "principal": {
      "type": "string",
      "minLength": 1
    },
    "action": {
      "type": "string",
      "minLength": 1
    },
    "resource": {
      "type": "object",
      "additionalProperties": true,
      "required": [
        "type",
        "id"
      ],
      "properties": {
        "type": {
          "type": "string",
          "minLength": 1
        },
        "id": {
          "type": "string",
          "minLength": 1
        },
        "uri": {
          "type": "string"
        }
      }
    },
    "constraints": {
      "type": "object",
      "additionalProperties": true
    },
    "context": {
      "type": "object",
      "additionalProperties": true
    },
    "parent_receipt_id": {
      "type": [
        "string",
        "null"
      ],
      "description": "Optional parent receipt identifier to link the requested action to a prior receipt. Chain continuity is not enforced until full receipt storage is available.",
      "minLength": 1
    }
  }
}
